<?xml version="1.0" encoding="utf-8"?>
<?xml-stylesheet type="text/xsl" href="http://errantlinguist.com/content/cv/publications/document.xsl"?>
<csx:document
	xmlns:csx="http://citeseerx.ist.psu.edu"
	xmlns:xsi="http://www.w3.org/2001/XMLSchema-instance"
	xsi:schemaLocation="http://citeseerx.ist.psu.edu http://errantlinguist.com/content/cv/publications/document.xsd"
	id="null">
	<clusterid xsi:nil="true"/>
	<title src="user correction">Psycholinguistic Experiments on Verb Aspect and Causality</title>
	<abstract>Verb aspect has been found to be an important factor when building up a situational model of events (Ferretti et al., 2009, Madden &amp; Zwaan, 2003). However, it is not clear yet, how verb aspect interacts with other properties of events, such as causality. This interaction between Verb Aspect and Causal Agents is the main interest of our study. In order to investigate both the final representation of the situation and the online processes in which the two kinds of information are integrated, we used two tasks: an online completion task and an online self paced reading task. Our experiments: Experiment 1 (completion task) and 2 (self-paced reading task) establish the Aspect effects on comprehension and Experiment 3 (completion task) and 4 (self-paced reading task) aim in revealing the interaction of Aspect and Causality. In the stimuli for Experiment 1, (example: "Während/Als Jan Franziska einen Ball gab, wollte..."), the "Während" stands for the imperfective condition and the "Als" for the perfective aspect. By using transfer of possession verbs the participant can focus on the process (imperfective), where he would complete the sentence referring back to the subject (NP1) or on the end phase of the event (perfective condition), in which he is expected to continue the sentence with an NP2 (second sentence participant) back reference.The same setup for the second set of experiments, which also involve causality, include stimuli as the following: "Während/Als Stefan Caroline nach Hause brachte, wollte...". We used causal movement verbs to attribute Causality to the Agent (Dowty, 1991) and study how its bias towards the Agent interacts with the Aspect bias (perfective aspect and causality clash, imperfective aspect and causality favor the same noun phrase). For the respective online experiments (Experiment 2 and 4), we added continuations, which were either congruent or incongruent with the biases of the factors and measured response times. The online results point to a general bias towards coreference, as opposed to introducing a new entity, but no clear tendency for a specific participant (NP1 or NP2). Also, the effect of Agent Causality appears to be strengthened in the case of the perfective aspect, where both factors favor the same participant. The online results are currently studied in detail, updates will be included in the talk.</abstract>
	<year src="user correction">2010</year>
	<venue src="user correction">48. Studentische Tagung der Sprachwissenschaft (STuTS 2010)</venue>
	<venType src="user correction">CONFERENCE</venType>
	<pages src="user correction">2--18</pages>
	<volume src="user correction"></volume>
	<number src="user correction"></number>
	<publisher src="user correction"></publisher>
	<pubAddress src="user correction">Potsdam, Germany</pubAddress>
	<tech src="user correction"></tech>
	<keywords></keywords>
	<authors>
		<author>
			<name src="user correction">Katerina Danae Kandylaki</name>
			<affil src="user correction">Saarland University</affil>
			<address src="user correction">Saarbrücken, Germany</address>
			<email src="user correction">aikater@coli.uni-sb.de</email>
			<order src="user correction">1</order>
		</author>
		<author>
			<name src="user correction">Casey Redd Kennington</name>
			<affil src="user correction">Saarland University</affil>
			<address src="user correction">Saarbrücken, Germany</address>
			<email src="user correction"></email>
			<order src="user correction">2</order>
		</author>		
		<author>
			<name src="user correction">Florian Niefind</name>
			<affil src="user correction">Saarland University</affil>
			<address src="user correction">Saarbrücken, Germany</address>
			<email src="user correction"></email>
			<order src="user correction">3</order>
		</author>
		<author>
			<name src="user correction">Andreas Rebmann</name>
			<affil src="user correction">Saarland University</affil>
			<address src="user correction">Saarbrücken, Germany</address>
			<email src="user correction"></email>
			<order src="user correction">4</order>
		</author>
		<author>
			<name src="user correction">Todd Shore</name>
			<affil src="user correction">Saarland University</affil>
			<address src="user correction">Saarbrücken, Germany</address>
			<email src="user correction"></email>
			<order src="user correction">5</order>
		</author>
		<author>
			<name src="user correction">Pirita Pyykkönen</name>
			<affil src="user correction">Saarland University</affil>
			<address src="user correction">Saarbrücken, Germany</address>
			<email src="user correction"></email>
			<order src="user correction">6</order>
		</author>		
	</authors>
	<fileInfo>
		<crawldate xsi:nil="true"/>
		<repID xsi:nil="true"/>
		<conversionTrace xsi:nil="true"/>
		<urls>
			<url>http://48.stuts.eu/files/Kandylaki_Aspect&amp;Causality.pdf</url>
		</urls>
	</fileInfo>
</csx:document>
