<?xml version="1.0" encoding="utf-8"?>
<?xml-stylesheet type="text/xsl" href="http://errantlinguist.com/content/cv/publications/document.xsl"?>
<csx:document
	xmlns:csx="http://citeseerx.ist.psu.edu"
	xmlns:xsi="http://www.w3.org/2001/XMLSchema-instance"
	xsi:schemaLocation="http://citeseerx.ist.psu.edu http://errantlinguist.com/content/cv/publications/document.xsd"
	id="null">
	<clusterid xsi:nil="true"/>
	<title src="user correction">Information Retrieval and Visualization for the Historical Domain</title>
	<abstract src="user correction">Associative adjectives such as in electrical engineer differ from ascriptive adjectives like in red house: They are syntactically similar, yet they do not denote an intersective  sense like ascriptive adjectives do. However, associative adjectives may (irregularly) denote ascriptive traits connected to the associated entity: The more semanticallysimilar two entities are, the more regular the traits are which are ascribed to them through association by a given adjective. This model of entities associated through family membership is analogous to a semantic network based on relative word similarities, in which families appear as clusters of relatively-similar entities.</abstract>
	<year src="user correction">2010</year>
	<venue src="user correction">SKASE Journal of Theoretical Linguistics</venue>
	<venType src="user correction">JOURNAL</venType>
	<pages src="user correction">2--18</pages>
	<volume src="user correction">7</volume>
	<number src="user correction">3</number>
	<publisher src="user correction">Slovak Association for the Study of English</publisher>
	<pubAddress src="user correction"></pubAddress>
	<tech src="user correction"></tech>
	<keywords>
		<keyword>lexical semantics</keyword>
		<keyword>adjectives</keyword>
		<keyword>modification</keyword>
		<keyword>predication</keyword>
		<keyword>similarity</keyword>
		<keyword>family resemblance</keyword>
		<keyword>ontology</keyword>
	</keywords>
	<authors>
		<author>
			<name src="user correction">Todd Shore</name>
			<affil src="user correction">Department of Computational Linguistics and Phonetics, Saarland University</affil>
			<address src="user correction">Buildings C7.1, C7.2 &amp; C7.4, 66041 Saarbr√ºcken, Germany</address>
			<email src="user correction">todd.shore@coli.uni-saarland.de</email>
			<order src="user correction">1</order>
		</author>
	</authors>
	<fileInfo>
		<crawldate xsi:nil="true"/>
		<repID xsi:nil="true"/>
		<conversionTrace xsi:nil="true"/>
		<urls>
			<url>http://www.skase.sk/Volumes/JTL17/pdf_doc/01.pdf</url>
		</urls>
	</fileInfo>
</csx:document>
