<?xml version="1.0" encoding="utf-8"?>
<?xml-stylesheet type="text/xsl" href="http://errantlinguist.com/content/cv/publications/document.xsl"?>
<csx:document
	xmlns:csx="http://citeseerx.ist.psu.edu"
	xmlns:xsi="http://www.w3.org/2001/XMLSchema-instance"
	xsi:schemaLocation="http://citeseerx.ist.psu.edu http://errantlinguist.com/content/cv/publications/document.xsd"
	id="null">
	<clusterid xsi:nil="true"/>
	<title src="user correction">Information Retrieval and Visualization for the Historical Domain</title>
	<abstract src="user correction">Working with large and unstructured collections of historical documents is a challenging task for historians. Despite the recent growth in the volume of digitized historical data, available collections are rarely accompanied by computational tools that significantly facilitate this task.We address this shortage by proposing a visualization method for document collections that focuses on graphical representation of similarities between documents. The strength of the similarities is measured according to the overlap of historically significant information such as named entities,or the overlap of general vocabulary. Similarity strengths are then encoded in the edges of a graph.The graph provides visual structure, revealing interpretable clusters and links between documents that are otherwise difficult to establish. We implement the idea of similarity graphs within an information retrieval system supported by an interactive graphical user interface. The system allows querying the database, visualizing the results and browsing the collection in an effective and intuitive way. Our aproach can be easy adapted and extended to collections of documents in other domains.</abstract>
	<year src="user correction">2011</year>
	<venue src="user correction">Language Technology for Cultural Heritage: Selected Papers from the LaTeCH Workshop Series</venue>
	<venType src="user correction">BOOKCHAPTER</venType>
	<pages src="user correction">197--212</pages>
	<volume src="user correction"></volume>
	<number src="user correction"></number>
	<publisher src="user correction">Springer</publisher>
	<pubAddress src="user correction"></pubAddress>
	<tech src="user correction"></tech>
	<keywords>
		<keyword>historical collections</keyword>
		<keyword>information retrieval</keyword>
		<keyword>graph visualization</keyword>
		<keyword>clustering</keyword>
		<keyword>recommender system</keyword>
	</keywords>
	<authors>
		<author id="null">
			<name src="user correction">Yevgeni Berzak</name>
			<affil src="user correction">Saarland University</affil>
			<address src="user correction">66041 Saarbr端cken, Germany</address>
			<email src="user correction">berzak@coli.uni-sb.de</email>
			<order src="user correction">1</order>
		</author>
		<author id="null">
			<name src="user correction">Michal Richter</name>
			<affil src="user correction">Saarland University</affil>
			<address src="user correction">66041 Saarbr端cken, Germany</address>
			<email src="user correction">mrichter@mpi-inf.mpg.de</email>
			<order src="user correction">2</order>
		</author>
		<author id="null">
			<name src="user correction">Carsten Ehrler</name>
			<affil src="user correction">Saarland University</affil>
			<address src="user correction">66041 Saarbr端cken, Germany</address>
			<email src="user correction">carsten.ehrler@gmail.com</email>
			<order src="user correction">3</order>
		<author id="null">
			<name src="user correction">Todd Shore</name>
			<affil src="user correction">Saarland University</affil>
			<address src="user correction">66041 Saarbr端cken, Germany</address>
			<email src="user correction">todd.shore@coli.uni-saarland.de</email>
			<order src="user correction">4</order>
		</author>
		</author>
	</authors>
	<fileInfo>
		<crawldate xsi:nil="true"/>
		<repID xsi:nil="true"/>
		<conversionTrace xsi:nil="true"/>
		<urls>
			<url>http://dx.doi.org/10.1007/978-3-642-20227-8_11</url>
		</urls>
	</fileInfo>
</csx:document>
